<?xml version="1.0" encoding="UTF-8"?>
<Users xmlns:xsi="http://www.w3.org/2001/XMLSchema-instance" xsi:noNamespaceSchemaLocation="userScheme.xsd">
  <User>
    <Name>Admin User</Name>
    <ID>1</ID>
    <Role>Admin</Role>
    <Email>admin@admin.com</Email>
    <Password>admin123</Password>
  </User>
  <User>
    <Name>Teacher One</Name>
    <ID>2</ID>
    <Role>Teacher</Role>
    <Email>teacher1@gmail.com</Email>
    <Password>teacher123</Password>
  </User>
  <User>
    <Name>Student One</Name>
    <ID>3</ID>
    <Role>Student</Role>
    <Email>student1@gmail.com</Email>
    <Password>student123</Password>
    <Class>Lab1</Class>
  </User>
  <User>
    <Name>Student Two</Name>
    <ID>4</ID>
    <Role>Student</Role>
    <Email>student2@gmail.com</Email>
    <Password>student123</Password>
    <Class>Lab2</Class>
  </User>
  <User>
    <Name>Student Three</Name>
    <ID>5</ID>
    <Role>Student</Role>
    <Email>student3@gmail.com</Email>
    <Password>student123</Password>
    <Class>Lab3</Class>
  </User>
  <User>
    <Name>Student Four</Name>
    <ID>12</ID>
    <Role>Student</Role>
    <Email>student4@gmail.com</Email>
    <Password>student123</Password>
    <Class>Lab1</Class>
  </User>
  <User>
    <Name>Student Five</Name>
    <ID>13</ID>
    <Role>Student</Role>
    <Email>student5@gmail.com</Email>
    <Password>student123</Password>
    <Class>Lab2</Class>
  </User>
  <User>
    <Name>Student Six</Name>
    <ID>14</ID>
    <Role>Student</Role>
    <Email>student6@gmail.com</Email>
    <Password>student123</Password>
    <Class>Lab3</Class>
  </User>
  <User>
    <Name>Student Seven</Name>
    <ID>15</ID>
    <Role>Student</Role>
    <Email>student7@gmail.com</Email>
    <Password>student123</Password>
    <Class>Lab1</Class>
  </User>
  <User>
    <Name>Student Eight</Name>
    <ID>16</ID>
    <Role>Student</Role>
    <Email>student8@gmail.com</Email>
    <Password>student123</Password>
    <Class>Lab2</Class>
  </User>
  <User>
    <Name>Student Nine</Name>
    <ID>17</ID>
    <Role>Student</Role>
    <Email>student9@gmail.com</Email>
    <Password>student123</Password>
    <Class>Lab3</Class>
  </User>
  <User>
    <Name>New User</Name>
    <ID>18</ID>
    <Role>Student</Role>
    <Email>newuser@gmail.com</Email>
    <Password>newuser123</Password>
    <Class>Lab1</Class>
  </User>
  <User>
    <Name>New User</Name>
    <ID>19</ID>
    <Role>Student</Role>
    <Email>newuser@gmail.com</Email>
    <Password>newuser123</Password>
    <Class>Lab1</Class>
  </User>
  <User>
    <Name>New User</Name>
    <ID>19</ID>
    <Role>Student</Role>
    <Email>newuser@gmail.com</Email>
    <Password>newuser123</Password>
    <Class>Lab1</Class>
  </User>
  <User>
    <Name>New User</Name>
    <ID>19</ID>
    <Role>Student</Role>
    <Email>newuser@gmail.com</Email>
    <Password>newuser123</Password>
    <Class>Lab1</Class>
  </User>
</Users>